{
  "$schema": "https://json-schema.org/draft/2020-12/schema",
  "title": "CSP customer profile",
  "type": "object",
  "additionalProperties": false,
  "properties": {
    "schemaVersion": {
      "const": 1
    },
    "id": {
      "type": "string",
      "pattern": "^[a-z0-9][a-z0-9-]*$"
    },
    "branding": {
      "type": "object",
      "additionalProperties": false,
      "properties": {
        "name": {
          "type": "string",
          "minLength": 1
        },
        "tagline": {
          "type": "string"
        },
        "description": {
          "type": "string"
        },
        "logoFile": {
          "type": "string",
          "minLength": 1
        },
        "iconFile": {
          "type": "string",
          "minLength": 1
        }
      },
      "required": ["name"]
    },
    "theme": {
      "type": "object",
      "additionalProperties": false,
      "properties": {
        "mode": {
          "enum": ["light", "dark", "system"],
          "default": "system"
        },
        "tokens": {
          "type": "object",
          "additionalProperties": false,
          "properties": {
            "accent": {
              "type": "string",
              "pattern": "^#[a-fA-F0-9]{6}$"
            },
            "accentSecondary": {
              "type": "string",
              "pattern": "^#[a-fA-F0-9]{6}$"
            },
            "hero": {
              "type": "string",
              "pattern": "^#[a-fA-F0-9]{6}$"
            },
            "paper": {
              "type": "string",
              "pattern": "^#[a-fA-F0-9]{6}$"
            },
            "card": {
              "type": "string",
              "pattern": "^#[a-fA-F0-9]{6}$"
            },
            "ink": {
              "type": "string",
              "pattern": "^#[a-fA-F0-9]{6}$"
            },
            "muted": {
              "type": "string",
              "pattern": "^#[a-fA-F0-9]{6}$"
            },
            "line": {
              "type": "string",
              "pattern": "^#[a-fA-F0-9]{6}$"
            },
            "soft": {
              "type": "string",
              "pattern": "^#[a-fA-F0-9]{6}$"
            },
            "success": {
              "type": "string",
              "pattern": "^#[a-fA-F0-9]{6}$"
            },
            "danger": {
              "type": "string",
              "pattern": "^#[a-fA-F0-9]{6}$"
            },
            "fontFamily": {
              "type": "string",
              "minLength": 1
            },
            "warning": {
              "type": "string",
              "pattern": "^#[a-fA-F0-9]{6}$"
            },
            "warningSurface": {
              "type": "string",
              "pattern": "^#[a-fA-F0-9]{6}$"
            },
            "warningInk": {
              "type": "string",
              "pattern": "^#[a-fA-F0-9]{6}$"
            },
            "neutral": {
              "type": "string",
              "pattern": "^#[a-fA-F0-9]{6}$"
            },
            "heroLine": {
              "type": "string",
              "pattern": "^#[a-fA-F0-9]{6}$"
            },
            "radius": {
              "type": "string",
              "pattern": "^(?:0|(?:\\d+(?:\\.\\d+)?|\\.\\d+)(?:px|rem|em))$"
            },
            "spacing": {
              "type": "string",
              "pattern": "^(?:0*[1-9]\\d*(?:\\.\\d+)?|\\d*\\.\\d*[1-9]\\d*)(?:px|rem|em)$"
            },
            "contentWidth": {
              "type": "string",
              "pattern": "^(?:0*[1-9]\\d*(?:\\.\\d+)?|\\d*\\.\\d*[1-9]\\d*)(?:px|rem|em)$"
            },
            "heroWidth": {
              "type": "string",
              "pattern": "^(?:0*[1-9]\\d*(?:\\.\\d+)?|\\d*\\.\\d*[1-9]\\d*)(?:px|rem|em)$"
            },
            "fontSize": {
              "type": "string",
              "pattern": "^(?:0*[1-9]\\d*(?:\\.\\d+)?|\\d*\\.\\d*[1-9]\\d*)(?:px|rem|em)$"
            },
            "fontMono": {
              "type": "string",
              "minLength": 1
            }
          }
        },
        "darkTokens": {
          "type": "object",
          "additionalProperties": false,
          "properties": {
            "accent": {
              "type": "string",
              "pattern": "^#[a-fA-F0-9]{6}$"
            },
            "accentSecondary": {
              "type": "string",
              "pattern": "^#[a-fA-F0-9]{6}$"
            },
            "hero": {
              "type": "string",
              "pattern": "^#[a-fA-F0-9]{6}$"
            },
            "paper": {
              "type": "string",
              "pattern": "^#[a-fA-F0-9]{6}$"
            },
            "card": {
              "type": "string",
              "pattern": "^#[a-fA-F0-9]{6}$"
            },
            "ink": {
              "type": "string",
              "pattern": "^#[a-fA-F0-9]{6}$"
            },
            "muted": {
              "type": "string",
              "pattern": "^#[a-fA-F0-9]{6}$"
            },
            "line": {
              "type": "string",
              "pattern": "^#[a-fA-F0-9]{6}$"
            },
            "soft": {
              "type": "string",
              "pattern": "^#[a-fA-F0-9]{6}$"
            },
            "success": {
              "type": "string",
              "pattern": "^#[a-fA-F0-9]{6}$"
            },
            "danger": {
              "type": "string",
              "pattern": "^#[a-fA-F0-9]{6}$"
            },
            "fontFamily": {
              "type": "string",
              "minLength": 1
            },
            "warning": {
              "type": "string",
              "pattern": "^#[a-fA-F0-9]{6}$"
            },
            "warningSurface": {
              "type": "string",
              "pattern": "^#[a-fA-F0-9]{6}$"
            },
            "warningInk": {
              "type": "string",
              "pattern": "^#[a-fA-F0-9]{6}$"
            },
            "neutral": {
              "type": "string",
              "pattern": "^#[a-fA-F0-9]{6}$"
            },
            "heroLine": {
              "type": "string",
              "pattern": "^#[a-fA-F0-9]{6}$"
            },
            "radius": {
              "type": "string",
              "pattern": "^(?:0|(?:\\d+(?:\\.\\d+)?|\\.\\d+)(?:px|rem|em))$"
            },
            "spacing": {
              "type": "string",
              "pattern": "^(?:0*[1-9]\\d*(?:\\.\\d+)?|\\d*\\.\\d*[1-9]\\d*)(?:px|rem|em)$"
            },
            "contentWidth": {
              "type": "string",
              "pattern": "^(?:0*[1-9]\\d*(?:\\.\\d+)?|\\d*\\.\\d*[1-9]\\d*)(?:px|rem|em)$"
            },
            "heroWidth": {
              "type": "string",
              "pattern": "^(?:0*[1-9]\\d*(?:\\.\\d+)?|\\d*\\.\\d*[1-9]\\d*)(?:px|rem|em)$"
            },
            "fontSize": {
              "type": "string",
              "pattern": "^(?:0*[1-9]\\d*(?:\\.\\d+)?|\\d*\\.\\d*[1-9]\\d*)(?:px|rem|em)$"
            },
            "fontMono": {
              "type": "string",
              "minLength": 1
            }
          }
        }
      }
    },
    "contact": {
      "type": "object",
      "additionalProperties": false,
      "properties": {
        "phone": {
          "type": "string",
          "minLength": 1
        },
        "label": {
          "type": "string"
        }
      },
      "required": ["phone"]
    },
    "public": {
      "type": "object",
      "additionalProperties": false,
      "properties": {
        "basePath": {
          "type": "string"
        },
        "apiUrl": {
          "type": "string"
        },
        "domain": {
          "type": "string"
        },
        "pollMs": {
          "type": "integer",
          "minimum": 1000
        },
        "demo": {
          "type": "boolean"
        },
        "staticDemo": {
          "type": "boolean"
        },
        "webmcp": {
          "type": "boolean",
          "default": true,
          "description": "Registers read-only WebMCP tools for browser agents. Set false to opt out."
        }
      }
    },
    "contentFile": {
      "type": "string",
      "minLength": 1
    },
    "avatarsFile": {
      "type": "string",
      "minLength": 1
    },
    "plugins": {
      "type": "array",
      "uniqueItems": true,
      "items": {
        "type": "string",
        "pattern": "^(?:@[a-z0-9][a-z0-9._-]*/)?[a-z0-9][a-z0-9._-]*$"
      }
    },
    "chatSupport": {
      "type": "object",
      "additionalProperties": false,
      "required": ["mode"],
      "properties": {
        "mode": {
          "enum": ["teams", "slack", "telegram", "demo"]
        },
        "tenantId": {
          "type": "string",
          "format": "uuid"
        },
        "clientId": {
          "type": "string",
          "format": "uuid"
        },
        "scope": {
          "type": "string",
          "minLength": 1
        },
        "auth": {
          "type": "string",
          "enum": ["msal", "session", "anonymous"],
          "description": "MSAL (default), authenticated same-origin gateway session, or anonymous browser session for Slack or Telegram."
        }
      },
      "allOf": [
        {
          "if": {
            "properties": {
              "mode": {
                "enum": ["teams", "slack", "telegram"]
              }
            },
            "not": {
              "properties": {
                "auth": {
                  "const": "anonymous"
                }
              },
              "required": ["auth"]
            }
          },
          "then": {
            "required": ["tenantId", "clientId", "scope"]
          }
        },
        {
          "if": {
            "properties": {
              "auth": {
                "const": "anonymous"
              }
            },
            "required": ["auth"]
          },
          "then": {
            "properties": {
              "mode": {
                "enum": ["slack", "telegram"]
              }
            }
          }
        }
      ]
    }
  },
  "required": [
    "schemaVersion",
    "id",
    "branding",
    "contact",
    "contentFile",
    "plugins"
  ]
}
